{
  "$schema": "http://json-schema.org/draft-07/schema#",
  "$id": "https://github.com/your-org/logix/docs/config.schema.json",
  "title": "Logix branding & UI configuration",
  "description": "Shared configuration consumed by the Windows sign-in popup, the central server, and the admin dashboard. All keys are optional; anything omitted falls back to built-in defaults. Copy windows/logbook_config.example.json or server/server_config.json and edit — never hardcode branding in source. This schema mirrors server/main.py's DEFAULT_CONFIG exactly; tests/test_config_schema.py fails if the two drift apart.",
  "type": "object",
  "properties": {
    "_comment": {
      "type": "string",
      "description": "Free-text note; ignored by all consumers."
    },
    "branding": {
      "type": "object",
      "description": "Visual identity shared across popup, dashboard, and reports.",
      "properties": {
        "logoText": {
          "type": "string",
          "description": "Short text logo shown when no image is set."
        },
        "logoPath": {
          "type": "string",
          "description": "Absolute path to a logo image (optional)."
        },
        "title": {
          "type": "string"
        },
        "subtitle": {
          "type": "string"
        },
        "colors": {
          "type": "object",
          "description": "Client & dashboard palette. The client (Windows popup/timer) resolves these via Get-LogbookTheme with the v4 \"Denyut\" defaults (lime on an ink ramp); a lab re-themes by overriding any key.",
          "properties": {
            "primary": {
              "type": "string",
              "pattern": "^#[0-9A-Fa-f]{6}$",
              "description": "Elevated surface (cards / inputs)."
            },
            "accent": {
              "type": "string",
              "pattern": "^#[0-9A-Fa-f]{6}$",
              "description": "Accent (lime #C5F23A by default)."
            },
            "onAccent": {
              "type": "string",
              "pattern": "^#[0-9A-Fa-f]{6}$",
              "description": "Text and icons drawn on the accent. Optional: when absent the client picks ink or white, whichever contrasts more with the accent."
            },
            "muted": {
              "type": "string",
              "pattern": "^#[0-9A-Fa-f]{6}$",
              "description": "Muted text."
            },
            "text": {
              "type": "string",
              "pattern": "^#[0-9A-Fa-f]{6}$",
              "description": "Primary text."
            },
            "surface": {
              "type": "string",
              "pattern": "^#[0-9A-Fa-f]{6}$",
              "description": "Deepest surface (fullscreen popup)."
            },
            "surfaceWidget": {
              "type": "string",
              "pattern": "^#[0-9A-Fa-f]{6}$",
              "description": "Corner timer widget surface."
            },
            "surfaceElevated": {
              "type": "string",
              "pattern": "^#[0-9A-Fa-f]{6}$",
              "description": "Raised panels / inputs."
            },
            "border": {
              "type": "string",
              "pattern": "^#[0-9A-Fa-f]{6}$",
              "description": "1px hairline border."
            }
          },
          "additionalProperties": false
        },
        "signals": {
          "type": "object",
          "description": "Solid status-bar signal colours -- status is a colored edge on a calm surface, never a tinted card.",
          "properties": {
            "normal": {
              "type": "string",
              "pattern": "^#[0-9A-Fa-f]{6}$",
              "description": "Session running (green)."
            },
            "notice": {
              "type": "string",
              "pattern": "^#[0-9A-Fa-f]{6}$",
              "description": "Privacy / screenshot (calm blue, never red)."
            },
            "warning": {
              "type": "string",
              "pattern": "^#[0-9A-Fa-f]{6}$",
              "description": "Attention (amber)."
            },
            "critical": {
              "type": "string",
              "pattern": "^#[0-9A-Fa-f]{6}$",
              "description": "Power countdown / urgent (red)."
            }
          },
          "additionalProperties": false
        }
      },
      "additionalProperties": false
    },
    "text": {
      "type": "object",
      "description": "All user-facing labels and hint strings. Localize here without touching code.",
      "properties": {
        "intro": {
          "type": "string"
        },
        "startHint": {
          "type": "string"
        },
        "namaLabel": {
          "type": "string"
        },
        "nimLabel": {
          "type": "string"
        },
        "accessLabel": {
          "type": "string"
        },
        "purposeLabel": {
          "type": "string"
        },
        "ketLabel": {
          "type": "string"
        },
        "submit": {
          "type": "string"
        },
        "hint": {
          "type": "string"
        },
        "hintIncomplete": {
          "type": "string"
        },
        "hintReady": {
          "type": "string"
        }
      },
      "additionalProperties": true
    },
    "accessTypes": {
      "type": "array",
      "description": "Options for the access-type dropdown.",
      "items": {
        "type": "string"
      }
    },
    "purposes": {
      "type": "array",
      "description": "Options for the session-purpose dropdown.",
      "items": {
        "type": "string"
      }
    },
    "requiredFields": {
      "type": "array",
      "description": "Which form fields must be filled before a session can start.",
      "items": {
        "type": "string",
        "enum": [
          "nama",
          "nim",
          "access",
          "purpose",
          "keterangan"
        ]
      }
    },
    "devices": {
      "type": "object",
      "description": "Device-naming options surfaced in the admin dashboard's Settings tab.",
      "properties": {
        "device_types": {
          "type": "array",
          "description": "Category options offered when naming/labeling a device.",
          "items": {
            "type": "string"
          }
        },
        "naming_pattern": {
          "type": "string",
          "description": "Suggested template for device display names, e.g. \"{type} - {room} - {number}\"."
        },
        "category": {
          "type": "string",
          "description": "This device's category, delivered by the server. Selects which idle_auto_end policy applies."
        },
        "idle_auto_end": {
          "type": "object",
          "description": "Per-category idle auto-end policy (Settings > Perangkat). Ships disabled for every category so an upgrade never starts closing sessions on its own. Idle is measured from input AND compute load, so long-running jobs stay 'active'. The user is warned 5 minutes before the session closes.",
          "additionalProperties": {
            "type": "object",
            "properties": {
              "enabled": {
                "type": "boolean",
                "description": "When false the category never auto-ends; the client reads the threshold as 0 = never."
              },
              "hours": {
                "type": "number",
                "minimum": 0.25,
                "description": "Idle hours before the session is closed automatically."
              }
            },
            "required": [
              "enabled"
            ],
            "additionalProperties": false
          }
        }
      },
      "additionalProperties": false
    },
    "reports": {
      "type": "object",
      "description": "Defaults for the Excel report generator (logix/logbook_report.py) and GET /api/reports.",
      "properties": {
        "default_scope": {
          "type": "string",
          "description": "Which range the report modal pre-selects.",
          "enum": [
            "today",
            "all",
            "range"
          ]
        },
        "include_branding": {
          "type": "boolean"
        },
        "include_purpose_summary": {
          "type": "boolean"
        },
        "include_device_summary": {
          "type": "boolean"
        }
      },
      "additionalProperties": false
    },
    "privacy": {
      "type": "object",
      "description": "Descriptive text shown to users about what's collected -- NOT the same as LOGIX_PRIVACY_MODE (an agent-local env var controlling whether logix/log_physical.py syncs to the central server at all; see docs/PRIVACY.md). This object never gates behavior, only what's displayed.",
      "properties": {
        "notice": {
          "type": "string"
        },
        "collected": {
          "type": "array",
          "items": {
            "type": "string"
          }
        },
        "not_collected": {
          "type": "array",
          "items": {
            "type": "string"
          }
        },
        "retention_days": {
          "type": "integer",
          "minimum": 0,
          "description": "Days to keep the personal fields (nama, NIM, Windows username, keterangan) on a session row. After this the row is redacted in place, never deleted -- utilisation history survives, the personal data does not. 0 disables purging."
        }
      },
      "additionalProperties": false
    }
  },
  "additionalProperties": false
}
