{
  "_comment": "Logix popup customization. Copy to C:\\lab\\logbook_config.json (machine-wide) or %APPDATA%\\Logix\\logbook_config.json (per-user). Per-user overrides machine, machine overrides built-in defaults. Every key is optional — omit anything you want left at the default.",

  "branding": {
    "logoText": "Logix",
    "logoPath": "C:\\lab\\logo.png",
    "title": "Report Logbook",
    "subtitle": "Computational Workstation",
    "colors": {
      "primary": "#1A1C20",
      "accent": "#C5F23A",
      "muted": "#8D939C",
      "text": "#EEF0F3",
      "surface": "#0B0C0E",
      "surfaceWidget": "#111214",
      "surfaceElevated": "#1A1C20",
      "border": "#2A2D33"
    },
    "signals": {
      "normal": "#3CCF78",
      "notice": "#3B82F6",
      "warning": "#F5B82E",
      "critical": "#FF5C61"
    }
  },

  "text": {
    "intro": "Isi data penggunaan workstation sebelum memulai sesi.",
    "startHint": "Waktu mulai akan dicatat saat tombol Mulai sesi ditekan.",
    "namaLabel": "Nama Pengguna",
    "nimLabel": "NIM/NIP/NIK",
    "accessLabel": "Tipe Akses",
    "purposeLabel": "Tujuan Penggunaan",
    "ketLabel": "Keterangan Kegiatan",
    "submit": "Mulai Sesi",
    "hint": "Mohon isi data dengan benar dan selengkap mungkin, apabila ada error atau kesalahan, segera hubungi admin.",
    "hintIncomplete": "Lengkapi Nama, NIM/ID, tipe akses, tujuan, dan keterangan.",
    "hintReady": "Siap disimpan. Tuliskan keterangan kegiatan sedetail mungkin agar mudah dipahami admin -- hanya nama, NIM, tipe akses, tujuan, dan keterangan yang dicatat, bukan aktivitas di layar Anda."
  },

  "accessTypes": ["Physical", "AnyDesk"],
  "purposes": ["Visualisasi Data", "Running Data", "Maintenance"],
  "requiredFields": ["nama", "nim", "access", "purpose", "keterangan"]
}
