{
    "branding": {
        "logoText": "FTMM",
        "logoPath": "C:\\lab\\logo.png",
        "title": "Report Logbook",
        "subtitle": "Computational Workstation",
        "colors": {
            "primary": "#073763",
            "accent": "#741B47",
            "muted": "#C0C0C0",
            "text": "#FFFFFF"
        }
    },
    "text": {
        "intro": "Isi data penggunaan workstation sebelum memulai sesi.",
        "startHint": "Waktu mulai akan dicatat saat tombol Mulai sesi ditekan.",
        "namaLabel": "Nama Pengguna",
        "nimLabel": "NIM/NIP/NIK",
        "accessLabel": "Tipe Akses",
        "purposeLabel": "Tujuan Penggunaan",
        "ketLabel": "Keterangan Kegiatan",
        "submit": "Mulai Sesi",
        "hint": "Mohon isi data dengan benar dan selengkap mungkin, apabila ada error atau kesalahan, segera hubungi admin.",
        "hintIncomplete": "Lengkapi Nama, NIM/ID, tipe akses, tujuan, dan keterangan.",
        "hintReady": "Siap disimpan. Nama, NIM, tujuan, dan keterangan akan dikirim ke SQLite."
    },
    "accessTypes": [
        "Physical",
        "AnyDesk"
    ],
    "purposes": [
        "Visualisasi Data",
        "Running Data",
        "Maintenance"
    ],
    "requiredFields": [
        "nama",
        "nim",
        "access",
        "purpose",
        "keterangan"
    ]
}